問題,解答1,解答2,解答3,正答,解説
新型コロナウイルスの感染経路として「せき、くしゃみ、会話等のときに排出される飛沫や〇〇の吸入」が考えられているが、〇〇に入る言葉は？,エアロゾル,エアロゲル,エアロビクス,1.エアロゾル,せき、くしゃみ、会話等のときに排出される飛沫やエアロゾルの吸入が主な感染経路と考えられています。
基本的な感染防止策として三密回避が求められる。「三密」は「密集」「密接」とあと一つは？,「密会」,「餡蜜（あんみつ）」,「密閉」,3.密閉,「三密」は、密閉空間（換気の悪い密閉空間である）、密集場所（多くの人が密集している）、密接場面（互いに手を伸ばしたら手が届く距離での会話や発声が行われる）という3つの条件をいいます。
基本的な感染防止策としてマスクの着用が求められるが、次の条件のうちマスクの着用が推奨される場合はどれ？,屋外で人とすれ違う,通勤ラッシュの電車の中,図書館で静かに過ごす,2.通勤ラッシュの電車の中,「マスクの着用」については、1.屋内において、他者と身体的距離（2m以上を目安）がとれない場合、2.屋内において、他者と距離がとれるが会話を行う場合、3.屋外において他者と距離がとれず会話を行う場合については、マスクの着用を推奨します。また、高齢者等との面会時や病院内など、重症化リスクの高い者と接する場合にはマスクの着用を推奨します。
基本的な感染防止策として「換気」があるが、「換気」について正しい内容はどれ？,エアコンには換気機能がついているのでエアコンを使用しているときは換気は不要,エアコンを使用しているときも、定期的な換気が必要,扇風機を使用していれば、換気は不要,2.エアコンを使用しているときも、定期的な換気が必要,エアコン・扇風機には通常換気機能は付いていません。エアコン・扇風機を使用しているときも換気は必要です。
政府が提供する接触確認アプリの正しい名称は？,COFFEE,CHOCOLATE,COCOA,3.COCOA,COCOAでは、スマートフォンのブルートゥース機能を利用して、陽性者と接触した可能性について通知を受けることができます。